{
  "oasVersion": "3.1",
  "title": "DON API v1",
  "description": "API of developer.overheid.nl (Developer Overheid).",
  "contact": {
    "name": "Team Developer Overheid",
    "email": "developer.overheid@geonovum.nl",
    "url": "https://developer.overheid.nl"
  },
  "resources": [
    {
      "name": "repository",
      "plural": "repositories",
      "readonly": false
    },
    {
      "name": "api",
      "plural": "apis",
      "readonly": true
    }
  ]
}
